{
  "schema_version": "alice.jurisdiction_context.v1",
  "jurisdiction_context_id": "e4420bac-f9d1-525b-9d48-16ab4962ee9b",
  "request_id": "b71f5ba1-f08d-447b-a91a-2a31724cd2f3",
  "subject_resolution_id": "c964d9cd-9df1-5d50-a1a6-0f5857d31e74",
  "session_state_ref": "alice/session_state.json",
  "request_mode": "deep_research",
  "active_subject_ids": [
    "subject-1"
  ],
  "subject_jurisdictions": [
    {
      "subject_id": "subject-1",
      "geography_status": "county_inferred",
      "state_fips": "48",
      "state_code": "TX",
      "state_name": "Texas",
      "county_fips": "48229",
      "county_name": "Hudspeth County",
      "city_or_place": null,
      "incorporated_status": "unknown",
      "derivation_types": [
        "subject_resolution_hint",
        "listing_url_slug_hint"
      ],
      "notes": []
    }
  ],
  "geography_status": "county_inferred",
  "state": {
    "fips": "48",
    "code": "TX",
    "name": "Texas",
    "resolution_status": "resolved",
    "derivation_type": "subject_resolution_hint",
    "subject_ids": [
      "subject-1"
    ],
    "notes": []
  },
  "county": {
    "fips": "48229",
    "name": "Hudspeth County",
    "resolution_status": "resolved",
    "derivation_type": "subject_resolution_hint",
    "subject_ids": [
      "subject-1"
    ],
    "notes": []
  },
  "city_or_place": {
    "name": null,
    "resolution_status": "unresolved",
    "derivation_type": null,
    "subject_ids": [
      "subject-1"
    ],
    "notes": []
  },
  "incorporated_status": "unknown",
  "county_fips": "48229",
  "state_fips": "48",
  "state_code": "TX",
  "derivation_sources": [
    {
      "derivation_id": "0747b4a3-3a9a-516d-9164-75cbc6c9df8a",
      "derivation_type": "subject_resolution_hint",
      "scope": "county",
      "subject_ids": [
        "subject-1"
      ],
      "state_fips": "48",
      "state_code": "TX",
      "state_name": "Texas",
      "county_fips": "48229",
      "county_name": "Hudspeth County",
      "city_name": null,
      "source_ref": "subject_resolution:active_subjects[0]",
      "confidence": 0.79,
      "notes": [
        "Step 4 subject identifiers already contained geography hints."
      ]
    },
    {
      "derivation_id": "e40a62bb-5923-5271-aae9-83eecbd63815",
      "derivation_type": "listing_url_slug_hint",
      "scope": "county",
      "subject_ids": [
        "subject-1"
      ],
      "state_fips": "48",
      "state_code": "TX",
      "state_name": "Texas",
      "county_fips": "48229",
      "county_name": "Hudspeth County",
      "city_name": null,
      "source_ref": "subject_resolution:normalized_inputs[0]",
      "confidence": 0.61,
      "notes": [
        "Listing URL path hints provided best-effort geography clues."
      ]
    }
  ],
  "jurisdiction_conflicts": [],
  "special_district_placeholders": [
    {
      "district_type": "appraisal_district",
      "status": "candidate",
      "name": "Hudspeth Appraisal District",
      "source_ids": [
        "county_tx_hudspeth_cad_property_search"
      ],
      "notes": [
        "Relevant special-district source is registered for this county context."
      ]
    },
    {
      "district_type": "appraisal_district",
      "status": "candidate",
      "name": "Hudspeth Appraisal District",
      "source_ids": [
        "county_tx_hudspeth_cad_public_information"
      ],
      "notes": [
        "Relevant special-district source is registered for this county context."
      ]
    }
  ],
  "effective_county_registry_ref": "registry/county_overrides/TX/48229.json",
  "effective_county_registry_mode": "curated_override",
  "unresolved_questions": [],
  "notes": [
    "A curated county registry override is available for this jurisdiction."
  ],
  "scores": {
    "jurisdiction_confidence": 0.8,
    "county_attachment_readiness": 1.0,
    "subject_alignment_score": 1.0
  },
  "generated_at": "2026-04-17T08:17:32.800817Z"
}