{
  "schema_version": "alice.jurisdiction_context.v1",
  "jurisdiction_context_id": "4596b489-87d0-51f9-b786-329486723668",
  "request_id": "2e69c948-d90f-4d57-ac4a-f1a017bb229d",
  "subject_resolution_id": "9b9e239f-9bd8-5d7d-abd1-e8b9095d38dd",
  "session_state_ref": "alice/session_state.json",
  "request_mode": "deep_research",
  "active_subject_ids": [
    "subject-1"
  ],
  "subject_jurisdictions": [
    {
      "subject_id": "subject-1",
      "geography_status": "unresolved",
      "state_fips": null,
      "state_code": null,
      "state_name": null,
      "county_fips": null,
      "county_name": null,
      "city_or_place": null,
      "incorporated_status": "unknown",
      "derivation_types": [],
      "notes": [
        "APN remained jurisdiction-unresolved because Step 5 will not infer county from APN format alone."
      ]
    }
  ],
  "geography_status": "unresolved",
  "state": {
    "fips": null,
    "code": null,
    "name": null,
    "resolution_status": "unresolved",
    "derivation_type": null,
    "subject_ids": [
      "subject-1"
    ],
    "notes": []
  },
  "county": {
    "fips": null,
    "name": null,
    "resolution_status": "unresolved",
    "derivation_type": null,
    "subject_ids": [
      "subject-1"
    ],
    "notes": []
  },
  "city_or_place": {
    "name": null,
    "resolution_status": "unresolved",
    "derivation_type": null,
    "subject_ids": [
      "subject-1"
    ],
    "notes": []
  },
  "incorporated_status": "unknown",
  "county_fips": null,
  "state_fips": null,
  "state_code": null,
  "derivation_sources": [],
  "jurisdiction_conflicts": [],
  "special_district_placeholders": [],
  "effective_county_registry_ref": null,
  "effective_county_registry_mode": "none",
  "unresolved_questions": [
    "What county or state should govern local parcel-level research before county registry coverage is attached?"
  ],
  "notes": [],
  "scores": {
    "jurisdiction_confidence": 0.12,
    "county_attachment_readiness": 0.0,
    "subject_alignment_score": 0.0
  },
  "generated_at": "2026-04-16T22:41:38.438973Z"
}