{
  "schema_version": "alice.jurisdiction_context.v1",
  "jurisdiction_context_id": "3ee368ef-484c-5574-92a6-cd586877303e",
  "request_id": "98df68eb-684b-4bec-b34b-8155a7fa1f39",
  "subject_resolution_id": "0a6f8866-1833-53af-a3be-e639f0fb46a6",
  "session_state_ref": "alice/session_state.json",
  "request_mode": "deep_research",
  "active_subject_ids": [
    "subject-1"
  ],
  "subject_jurisdictions": [
    {
      "subject_id": "subject-1",
      "geography_status": "county_inferred",
      "state_fips": "01",
      "state_code": "AL",
      "state_name": "Alabama",
      "county_fips": "01001",
      "county_name": "Autauga County",
      "city_or_place": null,
      "incorporated_status": "unknown",
      "derivation_types": [
        "subject_resolution_hint",
        "listing_url_slug_hint"
      ],
      "notes": []
    }
  ],
  "geography_status": "county_inferred",
  "state": {
    "fips": "01",
    "code": "AL",
    "name": "Alabama",
    "resolution_status": "resolved",
    "derivation_type": "subject_resolution_hint",
    "subject_ids": [
      "subject-1"
    ],
    "notes": []
  },
  "county": {
    "fips": "01001",
    "name": "Autauga County",
    "resolution_status": "resolved",
    "derivation_type": "subject_resolution_hint",
    "subject_ids": [
      "subject-1"
    ],
    "notes": []
  },
  "city_or_place": {
    "name": null,
    "resolution_status": "unresolved",
    "derivation_type": null,
    "subject_ids": [
      "subject-1"
    ],
    "notes": []
  },
  "incorporated_status": "unknown",
  "county_fips": "01001",
  "state_fips": "01",
  "state_code": "AL",
  "derivation_sources": [
    {
      "derivation_id": "9ae9bff3-5c46-5952-9623-d4713fca95a3",
      "derivation_type": "subject_resolution_hint",
      "scope": "county",
      "subject_ids": [
        "subject-1"
      ],
      "state_fips": "01",
      "state_code": "AL",
      "state_name": "Alabama",
      "county_fips": "01001",
      "county_name": "Autauga County",
      "city_name": null,
      "source_ref": "subject_resolution:active_subjects[0]",
      "confidence": 0.79,
      "notes": [
        "Step 4 subject identifiers already contained geography hints."
      ]
    },
    {
      "derivation_id": "d23e587a-c366-5e2b-8807-b20ed56ba913",
      "derivation_type": "listing_url_slug_hint",
      "scope": "county",
      "subject_ids": [
        "subject-1"
      ],
      "state_fips": "01",
      "state_code": "AL",
      "state_name": "Alabama",
      "county_fips": "01001",
      "county_name": "Autauga County",
      "city_name": null,
      "source_ref": "subject_resolution:normalized_inputs[0]",
      "confidence": 0.61,
      "notes": [
        "Listing URL path hints provided best-effort geography clues."
      ]
    }
  ],
  "jurisdiction_conflicts": [],
  "special_district_placeholders": [],
  "effective_county_registry_ref": "generated:county_fallback:01001",
  "effective_county_registry_mode": "generated_fallback",
  "unresolved_questions": [],
  "notes": [
    "County attachment is stable enough to use the county registry, but only the generated fallback entry exists today."
  ],
  "scores": {
    "jurisdiction_confidence": 0.8,
    "county_attachment_readiness": 1.0,
    "subject_alignment_score": 1.0
  },
  "generated_at": "2026-04-17T08:17:32.830363Z"
}